Script started on 2025-10-05 16:56:18-03:00 [TERM="xterm-256color" TTY="/dev/pts/0" COLUMNS="93" LINES="26"]
[?2004h]0;victorlzfr@Victor: ~/postgresql-learning[01;32mvictorlzfr@Victor[00m:[01;34m~/postgresql-learning[00m$ ps aux 
[?2004lUSER         PID %CPU %MEM    VSZ   RSS TTY      STAT START   TIME COMMAND
root           1  0.0  0.2 166020 10880 ?        Ss   15:59   0:00 /sbin/init
root           2  0.0  0.0   3072  1664 ?        Sl   15:59   0:00 /init
root           7  0.0  0.0   3088  1924 ?        Sl   15:59   0:00 plan9 --control-socket 7 -
root          61  0.0  0.3  64404 14360 ?        S<s  15:59   0:00 /lib/systemd/systemd-journ
root          85  0.0  0.1  23112  5888 ?        Ss   15:59   0:00 /lib/systemd/systemd-udevd
root          99  0.0  0.3 676340 13128 ?        Ssl  15:59   0:01 snapfuse /var/lib/snapd/sn
root         103  0.0  0.0 152992  1536 ?        Ssl  15:59   0:00 snapfuse /var/lib/snapd/sn
root         106  0.0  0.0 153520  1408 ?        Ssl  15:59   0:00 snapfuse /var/lib/snapd/sn
root         116  0.0  0.2 526812 11060 ?        Ssl  15:59   0:00 snapfuse /var/lib/snapd/sn
root         118  0.0  0.0 152992  1408 ?        Ssl  15:59   0:00 snapfuse /var/lib/snapd/sn
root         125  0.0  0.0 153124  1408 ?        Ssl  15:59   0:00 snapfuse /var/lib/snapd/sn
root         128  0.0  0.0 153124  1412 ?        Ssl  15:59   0:00 snapfuse /var/lib/snapd/sn
root         133  0.1  0.3 751104 13180 ?        Ssl  15:59   0:04 snapfuse /var/lib/snapd/sn
systemd+     167  0.0  0.3  26200 14076 ?        Ss   15:59   0:00 /lib/systemd/systemd-resol
systemd+     172  0.0  0.1  89364  7040 ?        Ssl  15:59   0:00 /lib/systemd/systemd-times
root         231  0.0  0.0   4308  2560 ?        Ss   15:59   0:00 /usr/sbin/cron -f -P
message+     234  0.0  0.1   8780  4352 ?        Ss   15:59   0:00 @dbus-daemon --system --ad
root         238  0.0  0.4  30092 17920 ?        Ss   15:59   0:00 /usr/bin/python3 /usr/bin/
syslog       242  0.0  0.1 222404  5376 ?        Ssl  15:59   0:00 /usr/sbin/rsyslogd -n -iNO
root         243  0.0  0.0   2892  1408 ?        Ss   15:59   0:00 /bin/sh /snap/cups/1112/sc
root         244  0.0  0.0   2892  1408 ?        Ss   15:59   0:00 /bin/sh /snap/cups/1112/sc
root         246  0.0  0.9 2218552 37864 ?       Ssl  15:59   0:01 /usr/lib/snapd/snapd
root         247  0.0  0.1  15324  7168 ?        Ss   15:59   0:00 /lib/systemd/systemd-login
root         279  0.0  0.0   3240  2176 hvc0     Ss+  15:59   0:00 /sbin/agetty -o -p -- \u -
root         284  0.0  0.0   3196  2176 tty1     Ss+  15:59   0:00 /sbin/agetty -o -p -- \u -
root         298  0.0  0.5 107152 21376 ?        Ssl  15:59   0:00 /usr/bin/python3 /usr/shar
root         498  0.0  0.0   3076  1024 ?        Ss   15:59   0:00 /init
root         500  0.0  0.0   3092  1156 ?        S    15:59   0:00 /init
victorl+     501  0.0  0.1   7444  6400 pts/0    Ss   15:59   0:00 -bash
root         502  0.0  0.1   7528  4608 pts/1    Ss   15:59   0:00 /bin/login -f
root         557  0.0  0.3 135136 12032 ?        Sl   15:59   0:00 cupsd -f -s /var/snap/cups
victorl+     585  0.0  0.2  17076  9344 ?        Ss   15:59   0:00 /lib/systemd/systemd --use
victorl+     586  0.0  0.1 103536  5288 ?        S    15:59   0:00 (sd-pam)
victorl+     598  0.0  0.1   6236  4864 pts/1    S+   15:59   0:00 -bash
root         623  0.0  0.4 260136 16896 ?        Sl   15:59   0:00 cups-browsed -c /var/snap/
snap_da+     630  0.0  0.1  14696  5888 ?        S    15:59   0:00 /snap/cups/1112/lib/cups/n
victorl+     920  0.0  0.0   3228  2048 pts/0    S+   16:56   0:00 script session.log
victorl+     921  0.0  0.1   6220  4992 pts/2    Ss   16:56   0:00 bash -i
victorl+     927  0.0  0.0   7484  3072 pts/2    R+   16:57   0:00 ps aux
[?2004h]0;victorlzfr@Victor: ~/postgresql-learning[01;32mvictorlzfr@Victor[00m:[01;34m~/postgresql-learning[00m$ su postgres
[?2004lPassword: 
[?2004h]0;postgres@Victor: /home/victorlzfr/postgresql-learning[01;32mpostgres@Victor[00m:[01;34m/home/victorlzfr/postgresql-learning[00m$ cd ..
[?2004lbash: cd: ..: Permission denied
[?2004h]0;postgres@Victor: /home/victorlzfr/postgresql-learning[01;32mpostgres@Victor[00m:[01;34m/home/victorlzfr/postgresql-learning[00m$ cd ..[Kcd ..[1Pexitsource ~/.bashrcexit[Kcd ..[Ksu victorlzfr
[?2004lPassword: 
[?2004h]0;victorlzfr@Victor: ~/postgresql-learning[01;32mvictorlzfr@Victor[00m:[01;34m~/postgresql-learning[00m$ cd ..
[?2004l[?2004h]0;victorlzfr@Victor: ~[01;32mvictorlzfr@Victor[00m:[01;34m~[00m$ ls
[?2004l[0m[01;34mpostgresql-install[0m  [01;34mpostgresql-learning[0m  [01;34msnap[0m
[?2004h]0;victorlzfr@Victor: ~[01;32mvictorlzfr@Victor[00m:[01;34m~[00m$ cd postgresql-install/
[?2004l[?2004h]0;victorlzfr@Victor: ~/postgresql-install[01;32mvictorlzfr@Victor[00m:[01;34m~/postgresql-install[00m$ ls
[?2004lCOPYRIGHT       HISTORY    aclocal.m4  [0m[01;32mconfig.status[0m  [01;34mcontrib[0m      meson_options.txt
GNUmakefile     Makefile   [01;34mconfig[0m      [01;32mconfigure[0m      [01;34mdoc[0m          [01;34msrc[0m
GNUmakefile.in  README.md  config.log  configure.ac   meson.build  [01;34mtmp_install[0m
[?2004h]0;victorlzfr@Victor: ~/postgresql-install[01;32mvictorlzfr@Victor[00m:[01;34m~/postgresql-install[00m$ cd [7m/usr/local/[27m/usr/local/
[?2004l[?2004h]0;victorlzfr@Victor: /usr/local[01;32mvictorlzfr@Victor[00m:[01;34m/usr/local[00m$ ls
[?2004l[0m[01;34mbin[0m  [01;34metc[0m  [01;34mgames[0m  [01;34minclude[0m  [01;34mlib[0m  [01;36mman[0m  [01;34mpgsql[0m  [01;34msbin[0m  [01;34mshare[0m  [01;34msrc[0m
[?2004h]0;victorlzfr@Victor: /usr/local[01;32mvictorlzfr@Victor[00m:[01;34m/usr/local[00m$ cd pgsql/
[?2004l[?2004h]0;victorlzfr@Victor: /usr/local/pgsql[01;32mvictorlzfr@Victor[00m:[01;34m/usr/local/pgsql[00m$ ls
[?2004l[0m[01;34mbin[0m  [01;34mdata[0m  [01;34minclude[0m  [01;34mlib[0m  [01;34mshare[0m
[?2004h]0;victorlzfr@Victor: /usr/local/pgsql[01;32mvictorlzfr@Victor[00m:[01;34m/usr/local/pgsql[00m$ cd bin/
[?2004l[?2004h]0;victorlzfr@Victor: /usr/local/pgsql/bin[01;32mvictorlzfr@Victor[00m:[01;34m/usr/local/pgsql/bin[00m$ ls
[?2004l[0m[01;32mclusterdb[0m   [01;32mpg_amcheck[0m         [01;32mpg_createsubscriber[0m  [01;32mpg_resetwal[0m      [01;32mpg_waldump[0m
[01;32mcreatedb[0m    [01;32mpg_archivecleanup[0m  [01;32mpg_ctl[0m               [01;32mpg_restore[0m       [01;32mpg_walsummary[0m
[01;32mcreateuser[0m  [01;32mpg_basebackup[0m      [01;32mpg_dump[0m              [01;32mpg_rewind[0m        [01;32mpgbench[0m
[01;32mdropdb[0m      [01;32mpg_checksums[0m       [01;32mpg_dumpall[0m           [01;32mpg_test_fsync[0m    [01;32mpostgres[0m
[01;32mdropuser[0m    [01;32mpg_combinebackup[0m   [01;32mpg_isready[0m           [01;32mpg_test_timing[0m   [01;32mpsql[0m
[01;32mecpg[0m        [01;32mpg_config[0m          [01;32mpg_receivewal[0m        [01;32mpg_upgrade[0m       [01;32mreindexdb[0m
[01;32minitdb[0m      [01;32mpg_controldata[0m     [01;32mpg_recvlogical[0m       [01;32mpg_verifybackup[0m  [01;32mvacuumdb[0m
[?2004h]0;victorlzfr@Victor: /usr/local/pgsql/bin[01;32mvictorlzfr@Victor[00m:[01;34m/usr/local/pgsql/bin[00m$ cd ..
[?2004l[?2004h]0;victorlzfr@Victor: /usr/local/pgsql[01;32mvictorlzfr@Victor[00m:[01;34m/usr/local/pgsql[00m$ ls
[?2004l[0m[01;34mbin[0m  [01;34mdata[0m  [01;34minclude[0m  [01;34mlib[0m  [01;34mshare[0m
[?2004h]0;victorlzfr@Victor: /usr/local/pgsql[01;32mvictorlzfr@Victor[00m:[01;34m/usr/local/pgsql[00m$ cd data/
[?2004lbash: cd: data/: Permission denied
[?2004h]0;victorlzfr@Victor: /usr/local/pgsql[01;32mvictorlzfr@Victor[00m:[01;34m/usr/local/pgsql[00m$ su postgres
[?2004lPassword: 
[?2004h]0;postgres@Victor: /usr/local/pgsql[01;32mpostgres@Victor[00m:[01;34m/usr/local/pgsql[00m$ cd data/
[?2004l[?2004h]0;postgres@Victor: /usr/local/pgsql/data[01;32mpostgres@Victor[00m:[01;34m/usr/local/pgsql/data[00m$ ls
[?2004lPG_VERSION    [0m[01;34mpg_dynshmem[0m    [01;34mpg_notify[0m     [01;34mpg_stat_tmp[0m  [01;34mpg_xact[0m
[01;34mbase[0m          pg_hba.conf    [01;34mpg_replslot[0m   [01;34mpg_subtrans[0m  postgresql.auto.conf
[01;34mglobal[0m        pg_ident.conf  [01;34mpg_serial[0m     [01;34mpg_tblspc[0m    postgresql.conf
logfile       [01;34mpg_logical[0m     [01;34mpg_snapshots[0m  [01;34mpg_twophase[0m  postmaster.opts
[01;34mpg_commit_ts[0m  [01;34mpg_multixact[0m   [01;34mpg_stat[0m       [01;34mpg_wal[0m       postmaster.pid
[?2004h]0;postgres@Victor: /usr/local/pgsql/data[01;32mpostgres@Victor[00m:[01;34m/usr/local/pgsql/data[00m$ pwd
[?2004l/usr/local/pgsql/data
[?2004h]0;postgres@Victor: /usr/local/pgsql/data[01;32mpostgres@Victor[00m:[01;34m/usr/local/pgsql/data[00m$ su victorlzfr
[?2004lPassword: 
su: Authentication failure
[?2004h]0;postgres@Victor: /usr/local/pgsql/data[01;32mpostgres@Victor[00m:[01;34m/usr/local/pgsql/data[00m$ su victorlzfr
[?2004lPassword: 
su: Authentication failure
[?2004h]0;postgres@Victor: /usr/local/pgsql/data[01;32mpostgres@Victor[00m:[01;34m/usr/local/pgsql/data[00m$ cd ..
[?2004l[?2004h]0;postgres@Victor: /usr/local/pgsql[01;32mpostgres@Victor[00m:[01;34m/usr/local/pgsql[00m$ cd ..su victorlzfr
[?2004lPassword: 
su: Authentication failure
[?2004h]0;postgres@Victor: /usr/local/pgsql[01;32mpostgres@Victor[00m:[01;34m/usr/local/pgsql[00m$ su victorlzfr
[?2004lPassword: 
[?2004h]0;victorlzfr@Victor: /usr/local/pgsql[01;32mvictorlzfr@Victor[00m:[01;34m/usr/local/pgsql[00m$ cd data/
[?2004lbash: cd: data/: Permission denied
[?2004h]0;victorlzfr@Victor: /usr/local/pgsql[01;32mvictorlzfr@Victor[00m:[01;34m/usr/local/pgsql[00m$ su postgres
[?2004lPassword: 
su: Authentication failure
[?2004h]0;victorlzfr@Victor: /usr/local/pgsql[01;32mvictorlzfr@Victor[00m:[01;34m/usr/local/pgsql[00m$ su postgres
[?2004lPassword: 
[?2004h]0;postgres@Victor: /usr/local/pgsql[01;32mpostgres@Victor[00m:[01;34m/usr/local/pgsql[00m$ cd sd[K[Kdata/
[?2004l[?2004h]0;postgres@Victor: /usr/local/pgsql/data[01;32mpostgres@Victor[00m:[01;34m/usr/local/pgsql/data[00m$ su victror[K[K[Korlzfr
[?2004lPassword: 
[?2004h]0;victorlzfr@Victor: /usr/local/pgsql/data[01;32mvictorlzfr@Victor[00m:[01;34m/usr/local/pgsql/data[00m$ ls
[?2004lls: cannot open directory '.': Permission denied
[?2004h]0;victorlzfr@Victor: /usr/local/pgsql/data[01;32mvictorlzfr@Victor[00m:[01;34m/usr/local/pgsql/data[00m$ cd ..
[?2004l[?2004h]0;victorlzfr@Victor: /usr/local/pgsql[01;32mvictorlzfr@Victor[00m:[01;34m/usr/local/pgsql[00m$ ls
[?2004l[0m[01;34mbin[0m  [01;34mdata[0m  [01;34minclude[0m  [01;34mlib[0m  [01;34mshare[0m
[?2004h]0;victorlzfr@Victor: /usr/local/pgsql[01;32mvictorlzfr@Victor[00m:[01;34m/usr/local/pgsql[00m$ ^C[?2004l[?2004h[?2004l
[?2004h]0;victorlzfr@Victor: /usr/local/pgsql[01;32mvictorlzfr@Victor[00m:[01;34m/usr/local/pgsql[00m$ [7mpg_ctl -D[27mpg_ctl -D [7m/usr/local/pgsql/data[27m/usr/local/pgsql/data start
[?2004lpg_ctl: could not open PID file "/usr/local/pgsql/data/postmaster.pid": Permission denied
[?2004h]0;victorlzfr@Victor: /usr/local/pgsql[01;32mvictorlzfr@Victor[00m:[01;34m/usr/local/pgsql[00m$ pg_ctl -D /usr/local/pgsql/data start[1@s[1@u[1@d[1@o[1@ 
[?2004l[sudo] password for victorlzfr: 
sudo: pg_ctl: command not found
[?2004h]0;victorlzfr@Victor: /usr/local/pgsql[01;32mvictorlzfr@Victor[00m:[01;34m/usr/local/pgsql[00m$ su postgres
[?2004lPassword: 
[?2004h]0;postgres@Victor: /usr/local/pgsql[01;32mpostgres@Victor[00m:[01;34m/usr/local/pgsql[00m$ [7mpg_ctl -D /usr/local/pgsql/data start[27m[C[C[C[C[C[C[C[C[C[C[C[C[C[C[C[C[C[C[C[C[C[C[C[C[C[C[C[C[C[C[C[C[C[Cpg_ctl -D /usr/local/pgsql/data start
[?2004lpg_ctl: another server might be running; trying to start server anyway
waiting for server to start....2025-10-05 17:06:05.215 -03 [1037] LOG:  starting PostgreSQL 19devel on x86_64-pc-linux-gnu, compiled by gcc (Ubuntu 11.4.0-1ubuntu1~22.04.2) 11.4.0, 64-bit
2025-10-05 17:06:05.216 -03 [1037] LOG:  listening on IPv4 address "127.0.0.1", port 5432
2025-10-05 17:06:05.225 -03 [1037] LOG:  listening on Unix socket "/tmp/.s.PGSQL.5432"
2025-10-05 17:06:05.261 -03 [1043] LOG:  database system was interrupted; last known up at 2025-10-05 13:49:41 -03
2025-10-05 17:06:05.595 -03 [1043] LOG:  database system was not properly shut down; automatic recovery in progress
2025-10-05 17:06:05.602 -03 [1043] LOG:  redo starts at 0/02464168
2025-10-05 17:06:05.602 -03 [1043] LOG:  invalid record length at 0/024642A8: expected at least 24, got 0
2025-10-05 17:06:05.602 -03 [1043] LOG:  redo done at 0/02464270 system usage: CPU: user: 0.00 s, system: 0.00 s, elapsed: 0.00 s
2025-10-05 17:06:05.613 -03 [1041] LOG:  checkpoint starting: end-of-recovery fast wait
2025-10-05 17:06:05.641 -03 [1041] LOG:  checkpoint complete: wrote 0 buffers (0.0%), wrote 3 SLRU buffers; 0 WAL file(s) added, 0 removed, 0 recycled; write=0.008 s, sync=0.004 s, total=0.033 s; sync files=2, longest=0.003 s, average=0.002 s; distance=0 kB, estimate=0 kB; lsn=0/024642A8, redo lsn=0/024642A8
2025-10-05 17:06:05.648 -03 [1037] LOG:  database system is ready to accept connections
 done
server started
[?2004h]0;postgres@Victor: /usr/local/pgsql[01;32mpostgres@Victor[00m:[01;34m/usr/local/pgsql[00m$ ps aux
[?2004lUSER         PID %CPU %MEM    VSZ   RSS TTY      STAT START   TIME COMMAND
root           1  0.0  0.2 166020 10880 ?        Ss   16:00   0:01 /sbin/init
root           2  0.0  0.0   3072  1664 ?        Sl   16:00   0:00 /init
root           7  0.0  0.0   3088  1924 ?        Sl   16:00   0:00 plan9 --control-socket 7 -
root          61  0.0  0.4  80796 18328 ?        S<s  16:00   0:00 /lib/systemd/systemd-journ
root          85  0.0  0.1  23112  5888 ?        Ss   16:00   0:00 /lib/systemd/systemd-udevd
root          99  0.0  0.3 676340 13128 ?        Ssl  16:00   0:01 snapfuse /var/lib/snapd/sn
root         103  0.0  0.0 152992  1536 ?        Ssl  16:00   0:00 snapfuse /var/lib/snapd/sn
root         106  0.0  0.0 153520  1408 ?        Ssl  16:00   0:00 snapfuse /var/lib/snapd/sn
root         116  0.0  0.2 526812 11060 ?        Ssl  16:00   0:00 snapfuse /var/lib/snapd/sn
root         118  0.0  0.0 152992  1408 ?        Ssl  16:00   0:00 snapfuse /var/lib/snapd/sn
root         125  0.0  0.0 153124  1408 ?        Ssl  16:00   0:00 snapfuse /var/lib/snapd/sn
root         128  0.0  0.0 153124  1412 ?        Ssl  16:00   0:00 snapfuse /var/lib/snapd/sn
root         133  0.1  0.3 751104 13180 ?        Ssl  16:00   0:04 snapfuse /var/lib/snapd/sn
systemd+     167  0.0  0.3  26200 14076 ?        Ss   16:00   0:00 /lib/systemd/systemd-resol
systemd+     172  0.0  0.1  89364  7040 ?        Ssl  16:00   0:00 /lib/systemd/systemd-times
root         231  0.0  0.0   4308  2560 ?        Ss   16:00   0:00 /usr/sbin/cron -f -P
message+     234  0.0  0.1   8780  4352 ?        Ss   16:00   0:00 @dbus-daemon --system --ad
root         238  0.0  0.4  30092 17920 ?        Ss   16:00   0:00 /usr/bin/python3 /usr/bin/
syslog       242  0.0  0.1 222404  5376 ?        Ssl  16:00   0:00 /usr/sbin/rsyslogd -n -iNO
root         243  0.0  0.0   2892  1408 ?        Ss   16:00   0:00 /bin/sh /snap/cups/1112/sc
root         244  0.0  0.0   2892  1408 ?        Ss   16:00   0:00 /bin/sh /snap/cups/1112/sc
root         246  0.0  0.9 2218552 37864 ?       Ssl  16:00   0:01 /usr/lib/snapd/snapd
root         247  0.0  0.1  15484  7168 ?        Ss   16:00   0:00 /lib/systemd/systemd-login
root         279  0.0  0.0   3240  2176 hvc0     Ss+  16:00   0:00 /sbin/agetty -o -p -- \u -
root         284  0.0  0.0   3196  2176 tty1     Ss+  16:00   0:00 /sbin/agetty -o -p -- \u -
root         298  0.0  0.5 107152 21376 ?        Ssl  16:00   0:00 /usr/bin/python3 /usr/shar
root         498  0.0  0.0   3076  1024 ?        Ss   16:00   0:00 /init
root         500  0.0  0.0   3092  1156 ?        D    16:00   0:00 /init
victorl+     501  0.0  0.1   7444  6400 pts/0    Ss   16:00   0:00 -bash
root         502  0.0  0.1   7528  4608 pts/1    Ss   16:00   0:00 /bin/login -f
root         557  0.0  0.3 135136 12032 ?        Sl   16:00   0:00 cupsd -f -s /var/snap/cups
victorl+     585  0.0  0.2  17076  9344 ?        Ss   16:00   0:00 /lib/systemd/systemd --use
victorl+     586  0.0  0.1 103536  5288 ?        S    16:00   0:00 (sd-pam)
victorl+     598  0.0  0.1   6236  4864 pts/1    S+   16:00   0:00 -bash
root         623  0.0  0.4 260136 16896 ?        Sl   16:00   0:00 cups-browsed -c /var/snap/
snap_da+     630  0.0  0.1  14696  5888 ?        S    16:00   0:00 /snap/cups/1112/lib/cups/n
victorl+     920  0.0  0.0   3228  2048 pts/0    R+   16:57   0:00 script session.log
victorl+     921  0.0  0.1   6220  4992 pts/2    Ss   16:57   0:00 bash -i
root         929  0.0  0.1   8056  5016 pts/2    S    16:58   0:00 su postgres
postgres     931  0.0  0.2  17048  9472 ?        Ss   16:58   0:00 /lib/systemd/systemd --use
postgres     932  0.0  0.1 169072  5304 ?        S    16:58   0:00 (sd-pam)
postgres     939  0.0  0.1   6084  4864 pts/2    S    16:58   0:00 bash
root         955  0.0  0.1   8056  5016 pts/2    S    16:59   0:00 su victorlzfr
victorl+     956  0.0  0.1   6344  5248 pts/2    S    16:59   0:00 bash
root         978  0.0  0.1   8056  5016 pts/2    S    17:00   0:00 su postgres
postgres     979  0.0  0.1   6216  5120 pts/2    S    17:00   0:00 bash
root         995  0.0  0.1   8060  5016 pts/2    S    17:03   0:00 su victorlzfr
victorl+     996  0.0  0.1   6216  5248 pts/2    S    17:03   0:00 bash
root        1005  0.0  0.1   8056  5016 pts/2    S    17:03   0:00 su postgres
postgres    1006  0.0  0.1   6216  5120 pts/2    S    17:03   0:00 bash
root        1015  0.0  0.1   8056  5016 pts/2    S    17:04   0:00 su victorlzfr
victorl+    1016  0.0  0.1   6216  4992 pts/2    S    17:04   0:00 bash
root        1026  0.3  0.1   8056  5016 pts/2    S    17:05   0:00 su postgres
postgres    1027  0.0  0.1   6084  4992 pts/2    S    17:05   0:00 bash
postgres    1037  2.7  0.5 204580 23296 ?        Ss   17:06   0:00 /usr/local/pgsql/bin/postg
postgres    1038  0.0  0.0 204712  3584 ?        Ss   17:06   0:00 postgres: io worker 0
postgres    1039  0.0  0.0 204580  3072 ?        Ss   17:06   0:00 postgres: io worker 1
postgres    1040  0.0  0.0 204580  3072 ?        Ss   17:06   0:00 postgres: io worker 2
postgres    1041  0.0  0.1 204712  5632 ?        Ss   17:06   0:00 postgres: checkpointer 
postgres    1042  0.0  0.0 204580  3328 ?        Ss   17:06   0:00 postgres: background write
postgres    1044  0.0  0.0 204712  3200 ?        Ss   17:06   0:00 postgres: walwriter 
postgres    1045  0.0  0.1 206168  6272 ?        Ss   17:06   0:00 postgres: autovacuum launc
postgres    1046  0.0  0.1 206032  5760 ?        Ss   17:06   0:00 postgres: logical replicat
postgres    1047  0.0  0.0   7484  3072 pts/2    R+   17:06   0:00 ps aux
[?2004h]0;postgres@Victor: /usr/local/pgsql[01;32mpostgres@Victor[00m:[01;34m/usr/local/pgsql[00m$ su d[Kvoc[K[Kictrorlz[Kzfr
[?2004lsu: user victrorlzfr does not exist or the user entry does not contain all the required fields
[?2004h]0;postgres@Victor: /usr/local/pgsql[01;32mpostgres@Victor[00m:[01;34m/usr/local/pgsql[00m$ su victorlç[Kzfr
[?2004lPassword: 
su: Authentication failure
[?2004h]0;postgres@Victor: /usr/local/pgsql[01;32mpostgres@Victor[00m:[01;34m/usr/local/pgsql[00m$ su victorlzfr
[?2004lPassword: 
su: Authentication failure
[?2004h]0;postgres@Victor: /usr/local/pgsql[01;32mpostgres@Victor[00m:[01;34m/usr/local/pgsql[00m$ su victorlzfr
[?2004lPassword: 
[?2004h]0;victorlzfr@Victor: /usr/local/pgsql[01;32mvictorlzfr@Victor[00m:[01;34m/usr/local/pgsql[00m$ [7msudo systemctl start postgresql[27msudo systemctl start postgresql
[?2004lFailed to start postgresql.service: Unit postgresql.service not found.
[?2004h]0;victorlzfr@Victor: /usr/local/pgsql[01;32mvictorlzfr@Victor[00m:[01;34m/usr/local/pgsql[00m$ createdb
[?2004l2025-10-05 17:07:29.811 -03 [1063] ERROR:  database "victorlzfr" already exists
2025-10-05 17:07:29.811 -03 [1063] STATEMENT:  CREATE DATABASE victorlzfr;
createdb: error: database creation failed: ERROR:  database "victorlzfr" already exists
[?2004h]0;victorlzfr@Victor: /usr/local/pgsql[01;32mvictorlzfr@Victor[00m:[01;34m/usr/local/pgsql[00m$ psql
[?2004lpsql (19devel)
Type "help" for help.

[?2004hvictorlzfr=> q
[?2004l[?2004hvictorlzfr-> |[K\q
[?2004l[?2004h]0;victorlzfr@Victor: /usr/local/pgsql[01;32mvictorlzfr@Victor[00m:[01;34m/usr/local/pgsql[00m$ Z[Kpsql
[?2004lpsql (19devel)
Type "help" for help.

[?2004hvictorlzfr=> \q[1Pq\q
[?2004l[?2004h]0;victorlzfr@Victor: /usr/local/pgsql[01;32mvictorlzfr@Victor[00m:[01;34m/usr/local/pgsql[00m$ psql mydb
[?2004lpsql (19devel)
Type "help" for help.

[?2004hmydb=> \q
[?2004l[?2004h]0;victorlzfr@Victor: /usr/local/pgsql[01;32mvictorlzfr@Victor[00m:[01;34m/usr/local/pgsql[00m$ psql mydb[K[K[K123[K[K[K[K123
[?2004l2025-10-05 17:10:50.535 -03 [1078] FATAL:  database "123" does not exist
psql: error: connection to server on socket "/tmp/.s.PGSQL.5432" failed: FATAL:  database "123" does not exist
[?2004h]0;victorlzfr@Victor: /usr/local/pgsql[01;32mvictorlzfr@Victor[00m:[01;34m/usr/local/pgsql[00m$ psql 123mydb
[?2004lpsql (19devel)
Type "help" for help.

[?2004hmydb=> \q[Kh
[?2004lAvailable help:
  ABORT                            CREATE USER MAPPING
  ALTER AGGREGATE                  CREATE VIEW
  ALTER COLLATION                  DEALLOCATE
  ALTER CONVERSION                 DECLARE
  ALTER DATABASE                   DELETE
  ALTER DEFAULT PRIVILEGES         DISCARD
  ALTER DOMAIN                     DO
  ALTER EVENT TRIGGER              DROP ACCESS METHOD
  ALTER EXTENSION                  DROP AGGREGATE
  ALTER FOREIGN DATA WRAPPER       DROP CAST
  ALTER FOREIGN TABLE              DROP COLLATION
  ALTER FUNCTION                   DROP CONVERSION
  ALTER GROUP                      DROP DATABASE
  ALTER INDEX                      DROP DOMAIN
  ALTER LANGUAGE                   DROP EVENT TRIGGER
  ALTER LARGE OBJECT               DROP EXTENSION
  ALTER MATERIALIZED VIEW          DROP FOREIGN DATA WRAPPER
  ALTER OPERATOR                   DROP FOREIGN TABLE
  ALTER OPERATOR CLASS             DROP FUNCTION
  ALTER OPERATOR FAMILY            DROP GROUP
  ALTER POLICY                     DROP INDEX
  ALTER PROCEDURE                  DROP LANGUAGE
  ALTER PUBLICATION                DROP MATERIALIZED VIEW
  ALTER ROLE                       DROP OPERATOR
[7m--More--[27m  ALTER ROUTINE                    DROP OPERATOR CLASS
[7m--More--[27m  ALTER RULE                       DROP OPERATOR FAMILY
[7m--More--[27m  ALTER SCHEMA                     DROP OWNED
[7m--More--[27m  ALTER SEQUENCE                   DROP POLICY
[7m--More--[27m  ALTER SERVER                     DROP PROCEDURE
[7m--More--[27m  ALTER STATISTICS                 DROP PUBLICATION
[7m--More--[27m  ALTER SUBSCRIPTION               DROP ROLE
[7m--More--[27m  ALTER SYSTEM                     DROP ROUTINE
[7m--More--[27m  ALTER TABLE                      DROP RULE
[7m--More--[27m  ALTER TABLESPACE                 DROP SCHEMA
[7m--More--[27m  ALTER TEXT SEARCH CONFIGURATION  DROP SEQUENCE
[7m--More--[27m  ALTER TEXT SEARCH DICTIONARY     DROP SERVER
[7m--More--[27m  ALTER TEXT SEARCH PARSER         DROP STATISTICS
[7m--More--[27m  ALTER TEXT SEARCH TEMPLATE       DROP SUBSCRIPTION
[7m--More--[27m  ALTER TRIGGER                    DROP TABLE
[7m--More--[27m  ALTER TYPE                       DROP TABLESPACE
[7m--More--[27m  ALTER USER                       DROP TEXT SEARCH CONFIGURATION
[7m--More--[27m  ALTER USER MAPPING               DROP TEXT SEARCH DICTIONARY
[7m--More--[27m  ALTER VIEW                       DROP TEXT SEARCH PARSER
[7m--More--[27m  ANALYZE                          DROP TEXT SEARCH TEMPLATE
[7m--More--[27m  BEGIN                            DROP TRANSFORM
[7m--More--[27m  CALL                             DROP TRIGGER
[7m--More--[27m  CHECKPOINT                       DROP TYPE
[7m--More--[27m  CLOSE                            DROP USER
[7m--More--[27m  CLUSTER                          DROP USER MAPPING
[7m--More--[27m  COMMENT                          DROP VIEW
[7m--More--[27m  COMMIT                           END
[7m--More--[27m  COMMIT PREPARED                  EXECUTE
[7m--More--[27m  COPY                             EXPLAIN
[7m--More--[27m  CREATE ACCESS METHOD             FETCH
[7m--More--[27m  CREATE AGGREGATE                 GRANT
[7m--More--[27m  CREATE CAST                      IMPORT FOREIGN SCHEMA
[7m--More--[27m  CREATE COLLATION                 INSERT
[7m--More--[27m  CREATE CONVERSION                LISTEN
[7m--More--[27m  CREATE DATABASE                  LOAD
[7m--More--[27m  CREATE DOMAIN                    LOCK
[7m--More--[27m  CREATE EVENT TRIGGER             MERGE
[7m--More--[27m  CREATE EXTENSION                 MOVE
[7m--More--[27m  CREATE FOREIGN DATA WRAPPER      NOTIFY
[7m--More--[27m  CREATE FOREIGN TABLE             PREPARE
[7m--More--[27m  CREATE FUNCTION                  PREPARE TRANSACTION
[7m--More--[27m  CREATE GROUP                     REASSIGN OWNED
[7m--More--[27m  CREATE INDEX                     REFRESH MATERIALIZED VIEW
[7m--More--[27m  CREATE LANGUAGE                  REINDEX
[7m--More--[27m  CREATE MATERIALIZED VIEW         RELEASE SAVEPOINT
[7m--More--[27m  CREATE OPERATOR                  RESET
[7m--More--[27m  CREATE OPERATOR CLASS            REVOKE
[7m--More--[27m  CREATE OPERATOR FAMILY           ROLLBACK
[7m--More--[27m  CREATE POLICY                    ROLLBACK PREPARED
[7m--More--[27m  CREATE PROCEDURE                 ROLLBACK TO SAVEPOINT
[7m--More--[27m  CREATE PUBLICATION               SAVEPOINT
[7m--More--[27m  CREATE ROLE                      SECURITY LABEL
[7m--More--[27m  CREATE RULE                      SELECT
[7m--More--[27m  CREATE SCHEMA                    SELECT INTO
[7m--More--[27m  CREATE SEQUENCE                  SET
[7m--More--[27m  CREATE SERVER                    SET CONSTRAINTS
[7m--More--[27m  CREATE STATISTICS                SET ROLE
[7m--More--[27m  CREATE SUBSCRIPTION              SET SESSION AUTHORIZATION
[7m--More--[27m  CREATE TABLE                     SET TRANSACTION
[7m--More--[27m  CREATE TABLE AS                  SHOW
[7m--More--[27m  CREATE TABLESPACE                START TRANSACTION
[7m--More--[27m  CREATE TEXT SEARCH CONFIGURATION TABLE
[7m--More--[27m  CREATE TEXT SEARCH DICTIONARY    TRUNCATE
[7m--More--[27m  CREATE TEXT SEARCH PARSER        UNLISTEN
[7m--More--[27m  CREATE TEXT SEARCH TEMPLATE      UPDATE
[7m--More--[27m  CREATE TRANSFORM                 VACUUM
[7m--More--[27m  CREATE TRIGGER                   VALUES
[7m--More--[27m  CREATE TYPE                      WITH
[7m--More--[27m  CREATE USER                      
[?2004hmydb=> 
[?2004l[?2004hmydb=> 
[?2004l[?2004hmydb=> 
[?2004l[?2004hmydb=> 
[?2004l[?2004hmydb=> 
[?2004l[?2004hmydb=> 
[?2004l[?2004hmydb=> 
[?2004l[?2004hmydb=> 
[?2004l[?2004hmydb=> 
[?2004l[?2004hmydb=> 
[?2004l[?2004hmydb=> \hqh[K\hq
[?2004l[?2004h]0;victorlzfr@Victor: /usr/local/pgsql[01;32mvictorlzfr@Victor[00m:[01;34m/usr/local/pgsql[00m$ ls
[?2004l[0m[01;34mbin[0m  [01;34mdata[0m  [01;34minclude[0m  [01;34mlib[0m  [01;34mshare[0m
[?2004h]0;victorlzfr@Victor: /usr/local/pgsql[01;32mvictorlzfr@Victor[00m:[01;34m/usr/local/pgsql[00m$ cd bin/
[?2004l[?2004h]0;victorlzfr@Victor: /usr/local/pgsql/bin[01;32mvictorlzfr@Victor[00m:[01;34m/usr/local/pgsql/bin[00m$ ls
[?2004l[0m[01;32mclusterdb[0m   [01;32mpg_amcheck[0m         [01;32mpg_createsubscriber[0m  [01;32mpg_resetwal[0m      [01;32mpg_waldump[0m
[01;32mcreatedb[0m    [01;32mpg_archivecleanup[0m  [01;32mpg_ctl[0m               [01;32mpg_restore[0m       [01;32mpg_walsummary[0m
[01;32mcreateuser[0m  [01;32mpg_basebackup[0m      [01;32mpg_dump[0m              [01;32mpg_rewind[0m        [01;32mpgbench[0m
[01;32mdropdb[0m      [01;32mpg_checksums[0m       [01;32mpg_dumpall[0m           [01;32mpg_test_fsync[0m    [01;32mpostgres[0m
[01;32mdropuser[0m    [01;32mpg_combinebackup[0m   [01;32mpg_isready[0m           [01;32mpg_test_timing[0m   [01;32mpsql[0m
[01;32mecpg[0m        [01;32mpg_config[0m          [01;32mpg_receivewal[0m        [01;32mpg_upgrade[0m       [01;32mreindexdb[0m
[01;32minitdb[0m      [01;32mpg_controldata[0m     [01;32mpg_recvlogical[0m       [01;32mpg_verifybackup[0m  [01;32mvacuumdb[0m
[?2004h]0;victorlzfr@Victor: /usr/local/pgsql/bin[01;32mvictorlzfr@Victor[00m:[01;34m/usr/local/pgsql/bin[00m$ cd ..
[?2004l[?2004h]0;victorlzfr@Victor: /usr/local/pgsql[01;32mvictorlzfr@Victor[00m:[01;34m/usr/local/pgsql[00m$ ls/
[?2004lbash: ls/: No such file or directory
[?2004h]0;victorlzfr@Victor: /usr/local/pgsql[01;32mvictorlzfr@Victor[00m:[01;34m/usr/local/pgsql[00m$ ls
[?2004l[0m[01;34mbin[0m  [01;34mdata[0m  [01;34minclude[0m  [01;34mlib[0m  [01;34mshare[0m
[?2004h]0;victorlzfr@Victor: /usr/local/pgsql[01;32mvictorlzfr@Victor[00m:[01;34m/usr/local/pgsql[00m$ cd data/
[?2004lbash: cd: data/: Permission denied
[?2004h]0;victorlzfr@Victor: /usr/local/pgsql[01;32mvictorlzfr@Victor[00m:[01;34m/usr/local/pgsql[00m$ su postgresq[K
[?2004lPassword: 
[?2004h]0;postgres@Victor: /usr/local/pgsql[01;32mpostgres@Victor[00m:[01;34m/usr/local/pgsql[00m$ chmod [K[K[K[K[K[K[7msudo usermod -a -G postgres victorlzfr[27m[C[C[C[C[C[C[C[C[C[C[C[C[C[C[C[C[C[C[C[C[C[C[C[C[C[C[C[C[C[C[C[C[C[Csudo usermod -a -G postgres victorlzfr
[?2004l[sudo] password for postgres: 
postgres is not in the sudoers file.  This incident will be reported.
[?2004h]0;postgres@Victor: /usr/local/pgsql[01;32mpostgres@Victor[00m:[01;34m/usr/local/pgsql[00m$ exit
[?2004lexit
[?2004h]0;victorlzfr@Victor: /usr/local/pgsql[01;32mvictorlzfr@Victor[00m:[01;34m/usr/local/pgsql[00m$ [7msudo usermod -a -G postgres victorlzfr[27m[C[C[C[C[C[C[C[C[C[C[C[C[C[C[C[C[C[C[C[C[C[C[C[C[C[C[C[C[C[C[C[C[C[C[C[Csudo usermod -a -G postgres victorlzfr
[?2004l[?2004h]0;victorlzfr@Victor: /usr/local/pgsql[01;32mvictorlzfr@Victor[00m:[01;34m/usr/local/pgsql[00m$ [7msudo chown -R postgres:postgres /usr/local/pgsql[27m[C[C[C[C[C[C[C[C[C[C[C[C[C[C[C[C[C[C[C[C[C[C[C[C[C[C[C[C[C[C[C[C[C[C[C[Csudo chown -R postgres:postgres /usr/local/pgsql
[?2004l[?2004h]0;victorlzfr@Victor: /usr/local/pgsql[01;32mvictorlzfr@Victor[00m:[01;34m/usr/local/pgsql[00m$ [7msudo chmod -R 775 /usr/local/pgsql[27msudo chmod -R 775 /usr/local/pgsql
[?2004l[?2004h]0;victorlzfr@Victor: /usr/local/pgsql[01;32mvictorlzfr@Victor[00m:[01;34m/usr/local/pgsql[00m$ cd data/
[?2004l[?2004h]0;victorlzfr@Victor: /usr/local/pgsql/data[01;32mvictorlzfr@Victor[00m:[01;34m/usr/local/pgsql/data[00m$ cd ..
[?2004l[?2004h]0;victorlzfr@Victor: /usr/local/pgsql[01;32mvictorlzfr@Victor[00m:[01;34m/usr/local/pgsql[00m$ ls data/
[?2004l[0m[01;32mPG_VERSION[0m    [01;34mpg_dynshmem[0m    [01;34mpg_notify[0m     [01;34mpg_stat_tmp[0m  [01;34mpg_xact[0m
[01;34mbase[0m          [01;32mpg_hba.conf[0m    [01;34mpg_replslot[0m   [01;34mpg_subtrans[0m  [01;32mpostgresql.auto.conf[0m
[01;34mglobal[0m        [01;32mpg_ident.conf[0m  [01;34mpg_serial[0m     [01;34mpg_tblspc[0m    [01;32mpostgresql.conf[0m
[01;32mlogfile[0m       [01;34mpg_logical[0m     [01;34mpg_snapshots[0m  [01;34mpg_twophase[0m  [01;32mpostmaster.opts[0m
[01;34mpg_commit_ts[0m  [01;34mpg_multixact[0m   [01;34mpg_stat[0m       [01;34mpg_wal[0m       [01;32mpostmaster.pid[0m
[?2004h]0;victorlzfr@Victor: /usr/local/pgsql[01;32mvictorlzfr@Victor[00m:[01;34m/usr/local/pgsql[00m$ cd [K[K[Kls
[?2004l[0m[01;34mbin[0m  [01;34mdata[0m  [01;34minclude[0m  [01;34mlib[0m  [01;34mshare[0m
[?2004h]0;victorlzfr@Victor: /usr/local/pgsql[01;32mvictorlzfr@Victor[00m:[01;34m/usr/local/pgsql[00m$ cd ..
[?2004l[?2004h]0;victorlzfr@Victor: /usr/local[01;32mvictorlzfr@Victor[00m:[01;34m/usr/local[00m$ ls
[?2004l[0m[01;34mbin[0m  [01;34metc[0m  [01;34mgames[0m  [01;34minclude[0m  [01;34mlib[0m  [01;36mman[0m  [01;34mpgsql[0m  [01;34msbin[0m  [01;34mshare[0m  [01;34msrc[0m
[?2004h]0;victorlzfr@Victor: /usr/local[01;32mvictorlzfr@Victor[00m:[01;34m/usr/local[00m$ cd src/
[?2004l[?2004h]0;victorlzfr@Victor: /usr/local/src[01;32mvictorlzfr@Victor[00m:[01;34m/usr/local/src[00m$ ls
[?2004l[?2004h]0;victorlzfr@Victor: /usr/local/src[01;32mvictorlzfr@Victor[00m:[01;34m/usr/local/src[00m$ ls
[?2004l[?2004h]0;victorlzfr@Victor: /usr/local/src[01;32mvictorlzfr@Victor[00m:[01;34m/usr/local/src[00m$ make
[?2004lmake: *** No targets specified and no makefile found.  Stop.
[?2004h]0;victorlzfr@Victor: /usr/local/src[01;32mvictorlzfr@Victor[00m:[01;34m/usr/local/src[00m$ pwd
[?2004l/usr/local/src
[?2004h]0;victorlzfr@Victor: /usr/local/src[01;32mvictorlzfr@Victor[00m:[01;34m/usr/local/src[00m$ ls
[?2004l[?2004h]0;victorlzfr@Victor: /usr/local/src[01;32mvictorlzfr@Victor[00m:[01;34m/usr/local/src[00m$ cd ..
[?2004l[?2004h]0;victorlzfr@Victor: /usr/local[01;32mvictorlzfr@Victor[00m:[01;34m/usr/local[00m$ ls
[?2004l[0m[01;34mbin[0m  [01;34metc[0m  [01;34mgames[0m  [01;34minclude[0m  [01;34mlib[0m  [01;36mman[0m  [01;34mpgsql[0m  [01;34msbin[0m  [01;34mshare[0m  [01;34msrc[0m
[?2004h]0;victorlzfr@Victor: /usr/local[01;32mvictorlzfr@Victor[00m:[01;34m/usr/local[00m$ ls
[?2004l[0m[01;34mbin[0m  [01;34metc[0m  [01;34mgames[0m  [01;34minclude[0m  [01;34mlib[0m  [01;36mman[0m  [01;34mpgsql[0m  [01;34msbin[0m  [01;34mshare[0m  [01;34msrc[0m
[?2004h]0;victorlzfr@Victor: /usr/local[01;32mvictorlzfr@Victor[00m:[01;34m/usr/local[00m$ cd u[K[K[K[Kcd ../
[?2004l[?2004h]0;victorlzfr@Victor: /usr[01;32mvictorlzfr@Victor[00m:[01;34m/usr[00m$ ls
[?2004l[0m[01;34mbin[0m  [01;34mgames[0m  [01;34minclude[0m  [01;34mlib[0m  [01;34mlib32[0m  [01;34mlib64[0m  [01;34mlibexec[0m  [01;34mlibx32[0m  [01;34mlocal[0m  [01;34msbin[0m  [01;34mshare[0m  [01;34msrc[0m
[?2004h]0;victorlzfr@Victor: /usr[01;32mvictorlzfr@Victor[00m:[01;34m/usr[00m$ cd ~
[?2004l[?2004h]0;victorlzfr@Victor: ~[01;32mvictorlzfr@Victor[00m:[01;34m~[00m$ çs
[?2004lçs: command not found
[?2004h]0;victorlzfr@Victor: ~[01;32mvictorlzfr@Victor[00m:[01;34m~[00m$ ls
[?2004l[0m[01;34mpostgresql-install[0m  [01;34mpostgresql-learning[0m  [01;34msnap[0m
[?2004h]0;victorlzfr@Victor: ~[01;32mvictorlzfr@Victor[00m:[01;34m~[00m$ cd posat[K[Ktgresql-install/
[?2004l[?2004h]0;victorlzfr@Victor: ~/postgresql-install[01;32mvictorlzfr@Victor[00m:[01;34m~/postgresql-install[00m$ ls
[?2004lCOPYRIGHT       HISTORY    aclocal.m4  [0m[01;32mconfig.status[0m  [01;34mcontrib[0m      meson_options.txt
GNUmakefile     Makefile   [01;34mconfig[0m      [01;32mconfigure[0m      [01;34mdoc[0m          [01;34msrc[0m
GNUmakefile.in  README.md  config.log  configure.ac   meson.build  [01;34mtmp_install[0m
[?2004h]0;victorlzfr@Victor: ~/postgresql-install[01;32mvictorlzfr@Victor[00m:[01;34m~/postgresql-install[00m$ cd src/
[?2004l[?2004h]0;victorlzfr@Victor: ~/postgresql-install/src[01;32mvictorlzfr@Victor[00m:[01;34m~/postgresql-install/src[00m$ ls
[?2004lDEVELOPERS          [0m[01;36mMakefile.port[0m   [01;34mcommon[0m      [01;34mmakefiles[0m      [01;34mport[0m      [01;34mtools[0m
Makefile            Makefile.shlib  [01;34mfe_utils[0m    meson.build    [01;34mtemplate[0m  [01;34mtutorial[0m
Makefile.global     [01;34mbackend[0m         [01;34minclude[0m     nls-global.mk  [01;34mtest[0m
Makefile.global.in  [01;34mbin[0m             [01;34minterfaces[0m  [01;34mpl[0m             [01;34mtimezone[0m
[?2004h]0;victorlzfr@Victor: ~/postgresql-install/src[01;32mvictorlzfr@Victor[00m:[01;34m~/postgresql-install/src[00m$ cd t
template/ test/     timezone/ tools/    tutorial/ 
]0;victorlzfr@Victor: ~/postgresql-install/src[01;32mvictorlzfr@Victor[00m:[01;34m~/postgresql-install/src[00m$ cd t
template/ test/     timezone/ tools/    tutorial/ 
]0;victorlzfr@Victor: ~/postgresql-install/src[01;32mvictorlzfr@Victor[00m:[01;34m~/postgresql-install/src[00m$ cd tutorial/
[?2004l[?2004h]0;victorlzfr@Victor: ~/postgresql-install/src/tutorial[01;32mvictorlzfr@Victor[00m:[01;34m~/postgresql-install/src/tutorial[00m$ ls
[?2004lMakefile  advanced.source  complex.c       funcs.c       syscat.source
README    basics.source    complex.source  funcs.source
[?2004h]0;victorlzfr@Victor: ~/postgresql-install/src/tutorial[01;32mvictorlzfr@Victor[00m:[01;34m~/postgresql-install/src/tutorial[00m$ cat re[K[KREADME 
[?2004lsrc/tutorial/README

tutorial
========

This directory contains SQL tutorial scripts.  To look at them, first do a
	% make
to compile all the scripts and C files for the user-defined functions
and types.  (make needs to be GNU make --- it may be named something
different on your system, often 'gmake')

Then, run psql with the -s (single-step) flag:
	% psql -s

From within psql, you can try each individual script file by using
psql's \i <filename> command.
[?2004h]0;victorlzfr@Victor: ~/postgresql-install/src/tutorial[01;32mvictorlzfr@Victor[00m:[01;34m~/postgresql-install/src/tutorial[00m$ MAKE[K[K[K[Kmake
[?2004lrm -f advanced.sql; \
C=`pwd`; \
sed -e "s:_OBJWD_:$C:g" < advanced.source > advanced.sql
rm -f basics.sql; \
C=`pwd`; \
sed -e "s:_OBJWD_:$C:g" < basics.source > basics.sql
rm -f complex.sql; \
C=`pwd`; \
sed -e "s:_OBJWD_:$C:g" < complex.source > complex.sql
rm -f funcs.sql; \
C=`pwd`; \
sed -e "s:_OBJWD_:$C:g" < funcs.source > funcs.sql
rm -f syscat.sql; \
C=`pwd`; \
sed -e "s:_OBJWD_:$C:g" < syscat.source > syscat.sql
gcc -Wall -Wmissing-prototypes -Wpointer-arith -Wdeclaration-after-statement -Werror=vla -Wendif-labels -Wmissing-format-attribute -Wimplicit-fallthrough=3 -Wcast-function-type -Wshadow=compatible-local -Wformat-security -fno-strict-aliasing -fwrapv -fexcess-precision=standard -Wno-format-truncation -Wno-stringop-truncation -O2 -fPIC -fvisibility=hidden -I. -I./ -I/usr/local/pgsql/include/server -I/usr/local/pgsql/include/internal -D_GNU_SOURCE      -c -o complex.o complex.c
gcc -Wall -Wmissing-prototypes -Wpointer-arith -Wdeclaration-after-statement -Werror=vla -Wendif-labels -Wmissing-format-attribute -Wimplicit-fallthrough=3 -Wcast-function-type -Wshadow=compatible-local -Wformat-security -fno-strict-aliasing -fwrapv -fexcess-precision=standard -Wno-format-truncation -Wno-stringop-truncation -O2 -fPIC -fvisibility=hidden complex.o -L/usr/local/pgsql/lib   -Wl,--as-needed -Wl,-rpath,'/usr/local/pgsql/lib',--enable-new-dtags -fvisibility=hidden -shared -o complex.so
gcc -Wall -Wmissing-prototypes -Wpointer-arith -Wdeclaration-after-statement -Werror=vla -Wendif-labels -Wmissing-format-attribute -Wimplicit-fallthrough=3 -Wcast-function-type -Wshadow=compatible-local -Wformat-security -fno-strict-aliasing -fwrapv -fexcess-precision=standard -Wno-format-truncation -Wno-stringop-truncation -O2 -fPIC -fvisibility=hidden -I. -I./ -I/usr/local/pgsql/include/server -I/usr/local/pgsql/include/internal -D_GNU_SOURCE      -c -o funcs.o funcs.c
gcc -Wall -Wmissing-prototypes -Wpointer-arith -Wdeclaration-after-statement -Werror=vla -Wendif-labels -Wmissing-format-attribute -Wimplicit-fallthrough=3 -Wcast-function-type -Wshadow=compatible-local -Wformat-security -fno-strict-aliasing -fwrapv -fexcess-precision=standard -Wno-format-truncation -Wno-stringop-truncation -O2 -fPIC -fvisibility=hidden funcs.o -L/usr/local/pgsql/lib   -Wl,--as-needed -Wl,-rpath,'/usr/local/pgsql/lib',--enable-new-dtags -fvisibility=hidden -shared -o funcs.so
[?2004h]0;victorlzfr@Victor: ~/postgresql-install/src/tutorial[01;32mvictorlzfr@Victor[00m:[01;34m~/postgresql-install/src/tutorial[00m$ [7mpsql -s mydb[27mpsql -s mydb
[?2004lpsql (19devel)
Type "help" for help.

[?2004hmydb=> \q[Ki basics.s[K[K[K[K[K[K[K[K[K[Kq
[?2004l[?2004h]0;victorlzfr@Victor: ~/postgresql-install/src/tutorial[01;32mvictorlzfr@Victor[00m:[01;34m~/postgresql-install/src/tutorial[00m$ psql -s mydb[8Pmake[K[K[K[Kls
[?2004lMakefile         advanced.sql   complex.c   complex.source  funcs.o       funcs.sql
README           basics.source  complex.o   complex.sql     [0m[01;32mfuncs.so[0m      syscat.source
advanced.source  basics.sql     [01;32mcomplex.so[0m  funcs.c         funcs.source  syscat.sql
[?2004h]0;victorlzfr@Victor: ~/postgresql-install/src/tutorial[01;32mvictorlzfr@Victor[00m:[01;34m~/postgresql-install/src/tutorial[00m$ lspsql -s mydb
[?2004lpsql (19devel)
Type "help" for help.

[?2004hmydb=> \q[Ki basics.sql 

mydb=> \i basics.sql 

mydb=> \i basics.sql 

mydb=> \i basics.sql [K
[?2004l/**(Single step mode: verify command)******************************************/
CREATE TABLE weather (
	city		varchar(80),
	temp_lo		int,		-- low temperature
	temp_hi		int,		-- high temperature
	prcp		real,		-- precipitation
	date		date
);
/**(press return to proceed or enter x and return to cancel)*******************/

CREATE TABLE
/**(Single step mode: verify command)******************************************/
CREATE TABLE cities (
	name		varchar(80),
	location	point
);
/**(press return to proceed or enter x and return to cancel)*******************/

CREATE TABLE
/**(Single step mode: verify command)******************************************/
INSERT INTO weather
    VALUES ('San Francisco', 46, 50, 0.25, '1994-11-27');
/**(press return to proceed or enter x and return to cancel)*******************/

INSERT 0 1
/**(Single step mode: verify command)******************************************/
INSERT INTO cities
    VALUES ('San Francisco', '(-194.0, 53.0)');
/**(press return to proceed or enter x and return to cancel)*******************/

INSERT 0 1
/**(Single step mode: verify command)******************************************/
INSERT INTO weather (city, temp_lo, temp_hi, prcp, date)
    VALUES ('San Francisco', 43, 57, 0.0, '1994-11-29');
/**(press return to proceed or enter x and return to cancel)*******************/

INSERT 0 1
/**(Single step mode: verify command)******************************************/
INSERT INTO weather (date, city, temp_hi, temp_lo)
    VALUES ('1994-11-29', 'Hayward', 54, 37);
/**(press return to proceed or enter x and return to cancel)*******************/

INSERT 0 1
/**(Single step mode: verify command)******************************************/
SELECT * FROM weather;
/**(press return to proceed or enter x and return to cancel)*******************/

     city      | temp_lo | temp_hi | prcp |    date    
---------------+---------+---------+------+------------
 San Francisco |      46 |      50 | 0.25 | 1994-11-27
 San Francisco |      43 |      57 |    0 | 1994-11-29
 Hayward       |      37 |      54 |      | 1994-11-29
(3 rows)

/**(Single step mode: verify command)******************************************/
SELECT city, (temp_hi+temp_lo)/2 AS temp_avg, date FROM weather;
/**(press return to proceed or enter x and return to cancel)*******************/

     city      | temp_avg |    date    
---------------+----------+------------
 San Francisco |       48 | 1994-11-27
 San Francisco |       50 | 1994-11-29
 Hayward       |       45 | 1994-11-29
(3 rows)

/**(Single step mode: verify command)******************************************/
SELECT *
    FROM weather
    WHERE city = 'San Francisco'
        AND prcp > 0.0;
/**(press return to proceed or enter x and return to cancel)*******************/

     city      | temp_lo | temp_hi | prcp |    date    
---------------+---------+---------+------+------------
 San Francisco |      46 |      50 | 0.25 | 1994-11-27
(1 row)

/**(Single step mode: verify command)******************************************/
SELECT * FROM weather
    ORDER BY city, temp_lo;
/**(press return to proceed or enter x and return to cancel)*******************/

     city      | temp_lo | temp_hi | prcp |    date    
---------------+---------+---------+------+------------
 Hayward       |      37 |      54 |      | 1994-11-29
 San Francisco |      43 |      57 |    0 | 1994-11-29
 San Francisco |      46 |      50 | 0.25 | 1994-11-27
(3 rows)

/**(Single step mode: verify command)******************************************/
SELECT DISTINCT city
    FROM weather
    ORDER BY city;
/**(press return to proceed or enter x and return to cancel)*******************/

     city      
---------------
 Hayward
 San Francisco
(2 rows)

/**(Single step mode: verify command)******************************************/
SELECT * FROM weather JOIN cities ON city = name;
/**(press return to proceed or enter x and return to cancel)*******************/

     city      | temp_lo | temp_hi | prcp |    date    |     name      | location  
---------------+---------+---------+------+------------+---------------+-----------
 San Francisco |      46 |      50 | 0.25 | 1994-11-27 | San Francisco | (-194,53)
 San Francisco |      43 |      57 |    0 | 1994-11-29 | San Francisco | (-194,53)
(2 rows)

/**(Single step mode: verify command)******************************************/
SELECT city, temp_lo, temp_hi, prcp, date, location
    FROM weather JOIN cities ON city = name;
/**(press return to proceed or enter x and return to cancel)*******************/

     city      | temp_lo | temp_hi | prcp |    date    | location  
---------------+---------+---------+------+------------+-----------
 San Francisco |      46 |      50 | 0.25 | 1994-11-27 | (-194,53)
 San Francisco |      43 |      57 |    0 | 1994-11-29 | (-194,53)
(2 rows)

/**(Single step mode: verify command)******************************************/
SELECT weather.city, weather.temp_lo, weather.temp_hi,
       weather.prcp, weather.date, cities.location
    FROM weather JOIN cities ON weather.city = cities.name;
/**(press return to proceed or enter x and return to cancel)*******************/

     city      | temp_lo | temp_hi | prcp |    date    | location  
---------------+---------+---------+------+------------+-----------
 San Francisco |      46 |      50 | 0.25 | 1994-11-27 | (-194,53)
 San Francisco |      43 |      57 |    0 | 1994-11-29 | (-194,53)
(2 rows)

/**(Single step mode: verify command)******************************************/
SELECT *
    FROM weather, cities
    WHERE city = name;
/**(press return to proceed or enter x and return to cancel)*******************/

     city      | temp_lo | temp_hi | prcp |    date    |     name      | location  
---------------+---------+---------+------+------------+---------------+-----------
 San Francisco |      46 |      50 | 0.25 | 1994-11-27 | San Francisco | (-194,53)
 San Francisco |      43 |      57 |    0 | 1994-11-29 | San Francisco | (-194,53)
(2 rows)

/**(Single step mode: verify command)******************************************/
SELECT *
    FROM weather LEFT OUTER JOIN cities ON weather.city = cities.name;
/**(press return to proceed or enter x and return to cancel)*******************/

     city      | temp_lo | temp_hi | prcp |    date    |     name      | location  
---------------+---------+---------+------+------------+---------------+-----------
 San Francisco |      46 |      50 | 0.25 | 1994-11-27 | San Francisco | (-194,53)
 San Francisco |      43 |      57 |    0 | 1994-11-29 | San Francisco | (-194,53)
 Hayward       |      37 |      54 |      | 1994-11-29 |               | 
(3 rows)

/**(Single step mode: verify command)******************************************/
SELECT w1.city, w1.temp_lo AS low, w1.temp_hi AS high,
       w2.city, w2.temp_lo AS low, w2.temp_hi AS high
FROM weather w1 JOIN weather w2
    ON w1.temp_lo < w2.temp_lo AND w1.temp_hi > w2.temp_hi;
/**(press return to proceed or enter x and return to cancel)*******************/

     city      | low | high |     city      | low | high 
---------------+-----+------+---------------+-----+------
 San Francisco |  43 |   57 | San Francisco |  46 |   50
 Hayward       |  37 |   54 | San Francisco |  46 |   50
(2 rows)

/**(Single step mode: verify command)******************************************/
SELECT max(temp_lo)
    FROM weather;
/**(press return to proceed or enter x and return to cancel)*******************/

 max 
-----
  46
(1 row)

/**(Single step mode: verify command)******************************************/
SELECT city FROM weather
    WHERE temp_lo = (SELECT max(temp_lo) FROM weather);
/**(press return to proceed or enter x and return to cancel)*******************/

     city      
---------------
 San Francisco
(1 row)

/**(Single step mode: verify command)******************************************/
SELECT city, count(*), max(temp_lo)
    FROM weather
    GROUP BY city;
/**(press return to proceed or enter x and return to cancel)*******************/

     city      | count | max 
---------------+-------+-----
 Hayward       |     1 |  37
 San Francisco |     2 |  46
(2 rows)

/**(Single step mode: verify command)******************************************/
SELECT city, count(*), max(temp_lo)
    FROM weather
    GROUP BY city
    HAVING max(temp_lo) < 40;
/**(press return to proceed or enter x and return to cancel)*******************/

  city   | count | max 
---------+-------+-----
 Hayward |     1 |  37
(1 row)

/**(Single step mode: verify command)******************************************/
SELECT city, count(*), max(temp_lo)
    FROM weather
    WHERE city LIKE 'S%'
    GROUP BY city;
/**(press return to proceed or enter x and return to cancel)*******************/



     city      | count | max 
---------------+-------+-----
 San Francisco |     2 |  46
(1 row)

/**(Single step mode: verify command)******************************************/
SELECT city, count(*) FILTER (WHERE temp_lo < 45), max(temp_lo)
    FROM weather
    GROUP BY city;
/**(press return to proceed or enter x and return to cancel)*******************/
     city      | count | max 
---------------+-------+-----
 Hayward       |     1 |  37
 San Francisco |     1 |  46
(2 rows)

/**(Single step mode: verify command)******************************************/
UPDATE weather
    SET temp_hi = temp_hi - 2,  temp_lo = temp_lo - 2
    WHERE date > '1994-11-28';
/**(press return to proceed or enter x and return to cancel)*******************/

UPDATE 2
/**(Single step mode: verify command)******************************************/
SELECT * FROM weather;
/**(press return to proceed or enter x and return to cancel)*******************/
     city      | temp_lo | temp_hi | prcp |    date    
---------------+---------+---------+------+------------
 San Francisco |      46 |      50 | 0.25 | 1994-11-27
 San Francisco |      41 |      55 |    0 | 1994-11-29
 Hayward       |      35 |      52 |      | 1994-11-29
(3 rows)

/**(Single step mode: verify command)******************************************/
DELETE FROM weather WHERE city = 'Hayward';
/**(press return to proceed or enter x and return to cancel)*******************/

DELETE 1
/**(Single step mode: verify command)******************************************/
SELECT * FROM weather;
/**(press return to proceed or enter x and return to cancel)*******************/

     city      | temp_lo | temp_hi | prcp |    date    
---------------+---------+---------+------+------------
 San Francisco |      46 |      50 | 0.25 | 1994-11-27
 San Francisco |      41 |      55 |    0 | 1994-11-29
(2 rows)

/**(Single step mode: verify command)******************************************/
DELETE FROM weather;
/**(press return to proceed or enter x and return to cancel)*******************/

DELETE 2
/**(Single step mode: verify command)******************************************/
SELECT * FROM weather;
/**(press return to proceed or enter x and return to cancel)*******************/

 city | temp_lo | temp_hi | prcp | date 
------+---------+---------+------+------
(0 rows)

/**(Single step mode: verify command)******************************************/
DROP TABLE weather, cities;
/**(press return to proceed or enter x and return to cancel)*******************/

DROP TABLE
[?2004hmydb=> 
[?2004l[?2004hmydb=> 
[?2004l[?2004hmydb=> 
[?2004l[?2004hmydb=> 
[?2004l[?2004hmydb=> 2025-10-05 17:27:54.441 -03 [1041] LOG:  checkpoint starting: time
2025-10-05 17:27:56.986 -03 [1041] LOG:  checkpoint complete: wrote 25 buffers (0.2%), wrote 1 SLRU buffers; 0 WAL file(s) added, 0 removed, 0 recycled; write=2.515 s, sync=0.012 s, total=2.546 s; sync files=23, longest=0.005 s, average=0.001 s; distance=104 kB, estimate=104 kB; lsn=0/0247E348, redo lsn=0/0247E2F0
^C[?2004l
[?2004hmydb=> [7mCREATE TABLE weather ([27m
[7m    city            varchar(80),[27m
[7m    temp_lo         int,           -- low temperature[27m
[7m    temp_hi         int,           -- high temperature[27m
[7m    prcp            real,          -- precipitation[27m
[7m    date            date[27m
[7m);[27m[A[A[A[A[A[A[C[C[C[C[C[9P\i basics.sql
[K
[K
[K
[K
[K
[K[A[A[A[A[A[A[C[C[C[C[C[C[C[C[C[C[C[C[C[C[C[C[C[C[C[C[C[C[C[C[C[C[CCREATE TABLE weather (
    city            varchar(80),
    temp_lo         int,           -- low temperature
    temp_hi         int,           -- high temperature
    prcp            real,          -- precipitation
    date            date
);
[?2004l/**(Single step mode: verify command)******************************************/
CREATE TABLE weather (
    city            varchar(80),
    temp_lo         int,           -- low temperature
    temp_hi         int,           -- high temperature
    prcp            real,          -- precipitation
    date            date
);
/**(press return to proceed or enter x and return to cancel)*******************/

CREATE TABLE
[?2004hmydb=> CREATE TABLE weather (
    city            varchar(80),
    temp_lo         int,           -- low temperature
    temp_hi         int,           -- high temperature
    prcp            real,          -- precipitation
    date            date
);[A[A[A[A[A[A[C[C[C[C[C[9P\i basics.sql
[K
[K
[K
[K
[K
[K[A[A[A[A[A[A[C[C[C[C[C[C[C[C[C[C[C[C[C[C[C[C[C[C[C[C[K[K[K[K[K[K[K[K[K[K[K[Kdt
[?2004l            List of tables
 Schema |  Name   | Type  |   Owner    
--------+---------+-------+------------
 public | weather | table | victorlzfr
(1 row)

[?2004hmydb=> [7mCREATE TABLE cities ([27m
[7m    name            varchar(80),[27m
[7m    location        point[27m
[7m);[27m[A[A[A[C[C[C[C[CCREATE TABLE cities (
    name            varchar(80),
    location        point
);
[?2004l/**(Single step mode: verify command)******************************************/
CREATE TABLE cities (
    name            varchar(80),
    location        point
);
/**(press return to proceed or enter x and return to cancel)*******************/

CREATE TABLE
[?2004hmydb=> CREATE TABLE cities (
    name            varchar(80),
    location        point
);[A[A[A[C[C[C[C[C[K
[K
[K
[K[A[A[A[C[C[C[C[C[C[CCREATE TABLE cities (
    name            varchar(80),
    location        point
);[A[A[A[C[C[C[C[C\dt[K
[K
[K
[K[A[A[A[C[C[C[C[C[C[C[C[C[C
[?2004l            List of tables
 Schema |  Name   | Type  |   Owner    
--------+---------+-------+------------
 public | cities  | table | victorlzfr
 public | weather | table | victorlzfr
(2 rows)

[?2004hmydb=> \dtCREATE TABLE cities (
    name            varchar(80),
    location        point
);[A[A[A[C[C[C[C[C\dt[K
[K
[K
[K[A[A[A[C[C[C[C[C[C[C[C[C[C[K[Kq
[?2004l[?2004h]0;victorlzfr@Victor: ~/postgresql-install/src/tutorial[01;32mvictorlzfr@Victor[00m:[01;34m~/postgresql-install/src/tutorial[00m$ exit
[?2004lexit
[?2004h]0;postgres@Victor: /usr/local/pgsql[01;32mpostgres@Victor[00m:[01;34m/usr/local/pgsql[00m$ exit
[?2004lexit
[?2004h]0;victorlzfr@Victor: /usr/local/pgsql[01;32mvictorlzfr@Victor[00m:[01;34m/usr/local/pgsql[00m$ [?2004l
exit
[?2004h]0;postgres@Victor: /usr/local/pgsql/data[01;32mpostgres@Victor[00m:[01;34m/usr/local/pgsql/data[00m$ [?2004l
exit
[?2004h]0;victorlzfr@Victor: /usr/local/pgsql[01;32mvictorlzfr@Victor[00m:[01;34m/usr/local/pgsql[00m$ cd ~
[?2004l[?2004h]0;victorlzfr@Victor: ~[01;32mvictorlzfr@Victor[00m:[01;34m~[00m$ ls
[?2004l[0m[01;34mpostgresql-install[0m  [01;34mpostgresql-learning[0m  [01;34msnap[0m
[?2004h]0;victorlzfr@Victor: ~[01;32mvictorlzfr@Victor[00m:[01;34m~[00m$ cd postgresql-learning/
[?2004l[?2004h]0;victorlzfr@Victor: ~/postgresql-learning[01;32mvictorlzfr@Victor[00m:[01;34m~/postgresql-learning[00m$ ls
[?2004lREADME.md  [0m[01;34mmilestones[0m  [01;34mscripts[0m  session.log
[?2004h]0;victorlzfr@Victor: ~/postgresql-learning[01;32mvictorlzfr@Victor[00m:[01;34m~/postgresql-learning[00m$ ls -l
[?2004ltotal 72
-rw-r--r-- 1 victorlzfr victorlzfr  1057 Oct  5 12:11 README.md
drwxr-xr-x 2 victorlzfr victorlzfr  4096 Oct  5 14:41 [0m[01;34mmilestones[0m
drwxr-xr-x 2 victorlzfr victorlzfr  4096 Oct  5 16:09 [01;34mscripts[0m
-rw-r--r-- 1 victorlzfr victorlzfr 57344 Oct  5 17:35 session.log
[?2004h]0;victorlzfr@Victor: ~/postgresql-learning[01;32mvictorlzfr@Victor[00m:[01;34m~/postgresql-learning[00m$ tail -20 session.log 
[?2004l
[?2004hmydb=> [7mCREATE TABLE cities ([27m
[7m    name            varchar(80),[27m
[7m    location        point[27m
[7m);[27m[A[A[A[C[C[C[C[CCREATE TABLE cities (
    name            varchar(80),
    location        point
);
[?2004l/**(Single step mode: verify command)******************************************/
CREATE TABLE cities (
    name            varchar(80),
    location        point
);
/**(press return to proceed or enter x and return to cancel)*******************/

CREATE TABLE
[?2004hmydb=> CREATE TABLE cities (
    name            varchar(80),
    location        point
);[A[A[A[C[C[?2004h]0;victorlzfr@Victor: ~/postgresql-learning[01;32mvictorlzfr@Victor[00m:[01;34m~/postgresql-learning[00m$ 2025-10-05 17:38:47.802 -03 [1041] LOG:  checkpoint starting: time
2025-10-05 17:38:50.251 -03 [1041] LOG:  checkpoint complete: wrote 24 buffers (0.1%), wrote 1 SLRU buffers; 0 WAL file(s) added, 0 removed, 0 recycled; write=2.416 s, sync=0.014 s, total=2.450 s; sync files=21, longest=0.005 s, average=0.001 s; distance=115 kB, estimate=115 kB; lsn=0/0249AF78, redo lsn=0/0249AF20
^C[?2004l[?2004h[?2004l
[?2004h]0;victorlzfr@Victor: ~/postgresql-learning[01;32mvictorlzfr@Victor[00m:[01;34m~/postgresql-learning[00m$ exit
[?2004lexit
[?2004h]0;postgres@Victor: /usr/local/pgsql[01;32mpostgres@Victor[00m:[01;34m/usr/local/pgsql[00m$ [?2004l
exit
[?2004h]0;victorlzfr@Victor: /usr/local/pgsql[01;32mvictorlzfr@Victor[00m:[01;34m/usr/local/pgsql[00m$ [?2004l
exit
[?2004h]0;postgres@Victor: /home/victorlzfr/postgresql-learning[01;32mpostgres@Victor[00m:[01;34m/home/victorlzfr/postgresql-learning[00m$ [?2004l
exit
[?2004h]0;victorlzfr@Victor: ~/postgresql-learning[01;32mvictorlzfr@Victor[00m:[01;34m~/postgresql-learning[00m$ [?2004l
exit

Script done on 2025-10-05 17:40:46-03:00 [COMMAND_EXIT_CODE="130"]
